invoice_id,auction_date,total_balance,stock_number,item,total,msrp,description,category,condition,image_urls,sales_price
020525-3501-209624,2025-02-05,8.56,144,"ULIKELED 3W 395NM LED Black Light, Flexible Gooseneck",2.45,8.99,"UV Blacklight for Satin Detection, Lamp for Blacklight Poster,
Blacklight Party, Ultraviolet Curing Lamp for Fluorescent Paint
Item Qty Bid Amount Premium Fee Tax Total
GREAT BLACK LIGHT FOR ARTWORK:This Flexible Little Black Light is pretty handy for working on art with fluroescent
and phosphorescent pigments|SMALL BUT POWERFUL UV LED:3W 395NM high power LED UV Blacklight, brings flicker-free UV light, high brightness|It's designed for blacklight parties, black light art, restaurant signage|COMPACT AND FLEXIBLE: 10"" Flexible gooseneck arm UV Black Fixture, you can set the light to anywhere you want to
get the perfect blacklight lamp lighting, showing your arts or signs more fessional|SIMPLE AND PORTABLE DESIGNED:54"" USB power cord with ON/OFF Switch, 120V US Power Adapter Included|You
can use this blacklight fixture with a power bank or computer|APPLICATION:The Ultra violet blacklights are widly used for blackight poster, glow party, black paints, fluorescent paints,
resin arts, ultraviolet curing, sain detection and apres gel X system",Art & Crafts,NEW,,0.0
020525-3501-209624,2025-02-05,8.56,183,Commercial Electric 4 in. J Box 8-Watt Dimmable White,2.45,19.97,"Round Flat Panel Ceiling Flush Mount Integrated LED Recessed
Light Color Changing CCT
Energy used: 8-Watt
Brightness: 500-Lumen
Life: 45|7-year (based on 3-hour/day)
Light appearance: 3000K/4000K/5000K (soft white/bright white/daylight)
Mercury free
Instant on to full brightness
Full range dimming with even light distribution
No ultraviolet light, safe for artwork
High output bright LED's for distance and close range indoor use
Fits most 4 in|recessed cans and J-boxes
Easy installation, standard base adaptor included
ENERGY STAR listed",Art & Crafts,NEW,,0.0
