invoice_id,auction_date,total_balance,stock_number,item,total,msrp,description,category,condition,image_urls,sales_price
012325-3501-207678,2025-01-23,20.78,590,L'OCCITANE Solid Stick Aluminum Free Deodorant: Reduce,2.45,22.0,"Body Odor, Alcohol-Free, Dries Quickly, Made in France, Fresh
Cyper and Lavender Scent, Woody Aroma, Refreshing Verbena
This men's stick deodorant glides on easily and dries quickly|Help prevent body odor and savor the crisp scent of citrusy Cedrat|Formulated
without alcohol or aluminum salts|Helps prevent body odor and delivers a crisp scent",General Merchandise,NEW,,0.0
012325-3501-207678,2025-01-23,20.78,596,AGE beautiful Permanent Hair Color Dye Liqui Creme | 100%,1.22,12.0,"Gray Coverage | Anti-Aging Haircolor | Biotin for Thicker, Fuller
Hair | Professional Salon Coloring
As we age, our hair experiences 5 signs of aging|It loses volume, manageability, color, moisture shine|AGEbeautiful Anti-Aging color is the 1st
permanent liqui-creme color developed to fight all 5 signs of aging hair|First color with melanin, keratin peptide, silk protein and a patented conditioning technology to replenish hair",Health & Beauty,NEW,,0.0
012325-3501-207678,2025-01-23,20.78,599,AGE beautiful Permanent Hair Color Dye Liqui Creme | 100%,1.22,12.0,"Gray Coverage | Anti-Aging Haircolor | Biotin for Thicker, Fuller
Hair | Professional Salon Coloring
As we age, our hair experiences 5 signs of aging|It loses volume, manageability, color, moisture shine|AGEbeautiful Anti-Aging color is the 1st
permanent liqui-creme color developed to fight all 5 signs of aging hair|First color with melanin, keratin peptide, silk protein and a patented conditioning technology to replenish hair",Health & Beauty,NEW,,0.0
012325-3501-207678,2025-01-23,20.78,603,"RevitaLash Cosmetics, RevitaLash Advanced Eyelash",3.67,59.0,"Conditioner, Lash Enhancing Serum, Physician Developed &
Cruelty-Free
An original, Physician developed lash conditioner addresses the visible signs of eyelash aging due to chemical and environmental stressors,
leading to healthier-looking, more luxurious lashes|Our award-winning lash conditioner enhances & protect against breakage while improving flexibility & shine",Health & Beauty,NEW,,0.0
012325-3501-207678,2025-01-23,20.78,607,"RevitaLash Cosmetics, RevitaLash Advanced Eyelash",3.67,59.0,"Conditioner, Lash Enhancing Serum, Physician Developed &
Cruelty-Free
An original, Physician developed lash conditioner addresses the visible signs of eyelash aging due to chemical and environmental stressors,
leading to healthier-looking, more luxurious lashes|Our award-winning lash conditioner enhances & protect against breakage while improving flexibility & shine|Item Qty Bid Amount Premium Fee Tax Total",Health & Beauty,NEW,,0.0
012325-3501-207678,2025-01-23,20.78,628,Women's Elegant Crossover Swimsuit Pink Polka Dot XL,4.89,9.99,No additional description provided in the invoice.,General Merchandise,NEW,,0.0
012325-3501-207678,2025-01-23,20.78,634,"COLORCHARM Demi Permanent Hair Color, Hair Dye for",1.22,9.99,"Gray Hair Coverage, Adds Gloss, 2 oz 7WG Medium Caramel
Blonde
Our 21 WELLA colorcharm Demi-Permanent shades offer shiny-looking color with less damage, letting you gloss, tone, refresh, or enhance hair
color|With a wide palette of Blonde, Red, Violet and deep Brunette shades, we have every color needed to create the look you desire|Or simply
add some gloss with our Clear shade|Permanent color
All 21 Demi-Permanent shades are enriched with Shea Butter|Free of ammonia, gluten, parabens, and animal-derived ingredients|Demi-Perms
add new richness or fashion tones to your existing color",Health & Beauty,NEW,,0.0
012325-3501-207678,2025-01-23,20.78,658,"Press-On Nails, One Minute Nail Tips, 24pcs",2.45,0.0,No additional description provided in the invoice.,Tools & Hardware,NEW,,0.0
