invoice_id,auction_date,total_balance,stock_number,item,total,msrp,description,category,condition,image_urls,sales_price
082824-3501-186858,2024-08-28,80.7,115,"6-Light Orb Chandelier, Black Globe Pendant Light Fixtures,",12.23,109.99,"Industrial Sphere Pendant Lighting Over Island, Adjustable
Hanging Light with Metal Cage for Dining Room, Foyer, E12 Bulbs
Not Included
Item Qty Bid Amount Premium Fee Tax Total
【Unique Design】 The sphere cage pendant light is made of 4 outer rings that uniquely blend industrial and vintage
styles, featuring a matte black finish and orb chandeliers design that creates a fashionable look and complements any
room decor|【Adjustable Chain】 Lampshade: Height 25|98 inch x Diameter 23|Canopy: Height 1|18 inch x Diameter 5|With an adjustable chain length of up to 25|98 inches, this dining room light fixture can be easily adjusted to fit your
preferred height and design|The farmhouse pendant lights can be hung from a sloped or vaulted ceiling, which is more
accent or mood lighting|【Easy to Install】 The foyer lighting fixtures include all necessary hardware and instructions|You only need to fix the 4
outer rings with round nuts at the top and bottom, slide the rings into a spherical shape, use the last ring to fix the place
and the globe chandelier light fixture will be ready to be hung|【6*E12 Socket】 The dining room chandeliers come with 6*E12 candelabra lamp bases, compatible with various kinds
of E12 bulbs|Max Wattage: 40W each (Bulbs NOT Included)|Ideal for kitchen island, dining room, living room, bathroom,
entry, office, foyer, bedroom, hallway, bar, entryway, etc",Home & Garden,NEW,,0.0
082824-3501-186858,2024-08-28,80.7,147,Dayao Toilet Seat,2.45,119.0,No additional description provided in the invoice.,Automotive,NEW,,0.0
082824-3501-186858,2024-08-28,80.7,152,Deynite Industrial Pendant Light Fixtures Black Schoolhouse,3.67,119.0,"Hanging Adjustable Light for Kitchen Island
Design:This modern pendant light ceiling hanging is proud to introduce a black finish accented with milky glass shade|This schoolhouse pendant lighting is a perfect choice over your kitchen island or dining area|Adjustable Height :The height of rod and angle of canopy are adjustable,sloped ceiling compatible,allowing you to
customize the fixture to your lighting need and desired look|Minimum adjusted height: 21|Dimmable: Designed to be dimmable when used with a compatible dimmer switch and bulb (not included); allowing you to
adjust the preferred light brightness|Safety: ETL listed for dry locations,hardwired,E26 base,60 W max(Not Included)|Application:This black pendant light is ideal as kitchen island ceiling lighting, over a kitchen table or as kitchen light
fixtures, as a dining room light or foyer lighting,as a bar area or porch hanging light, and more|Item Qty Bid Amount Premium Fee Tax Total",Home & Garden,NEW,,0.0
082824-3501-186858,2024-08-28,80.7,260,"1 Inch Modern Double Window Curtain Rods,72-144 Inch",2.45,45.99,"Adjustable Telescoping Heavy Duty Stylish Drapery Rods
Decorative Solid Square Allufer Finials for Dual Curtain Rod
Window Treatment,Nicked Brushed
GEOMETRIC SQUARE DOUBLE CURTAIN RODS: this design provide a sleek and modern look to any room, with their
clean lines and minimalist design|This Double rod allows for hanging of both sheer and blackout curtains at the same
time, adding versatility to your window treatments
TELESCOPING ADJUSTABLE STRUCTURE:classic telescoping structures for easy adjustments to fit various window
sizes,provide a verstile option for haning different types of curtains such as grommet,tab-top or rod-pocket curtains
DURABLE AND RELIABLE: This modern curtain rods are generally made from high-quality iron, 1-Inch diameter on front
rod and 5/8-Inch diameter on back rod, the bracket are choosing solid aluminum bracket which ensure durability and
longevity|These materials are resistant to rust, corrosion, and damage caused by moisture, sunlight, or temperature
changes, making them suitable for use in any room or climate
VERSATILE FINISHES FOR DIFFERENT DECO STYLE:Square double curtain rods are available in a variety of finishes,
including brushed nickel, matte black painting,electric brushed brass,the use of different finishes helps match the curtain
rods to the decor of the room seamlessly|The finishes offer benefits such as resistance to rust, corrosion, or discoloration,
making them more durable and long-lasting",Home & Garden,NEW,,0.0
